[
  {"id":"price-cp42","serviceId":"cp42","currency":"GBP","amountMinor":24900,"display":"£249","status":"active","conditions":[],"source":{"type":"owner-approved","reference":"GetGasCert public website canonical pricing","verifiedAt":"2026-08-13"},"approved":true},
  {"id":"price-cp44","serviceId":"cp44","currency":"GBP","amountMinor":19900,"display":"£199","status":"active","conditions":[],"source":{"type":"owner-approved","reference":"GetGasCert public website canonical pricing","verifiedAt":"2026-08-13"},"approved":true},
  {"id":"price-cp12","serviceId":"cp12","currency":"GBP","amountMinor":11900,"display":"£119","status":"active","conditions":[],"source":{"type":"owner-approved","reference":"GetGasCert public website canonical pricing","verifiedAt":"2026-08-13"},"approved":true}
]
